{
  "author": {
    "name": "Jason Brashear",
    "url": "https://github.com/webdevtodayjason",
    "tiinyverse": "https://www.tiinyverse.com/users/39628b1e-e94e-4bd8-800e-5437d5336e1f"
  },
  "screenshots": [],
  "verified": false,
  "featured": true,
  "addedAt": "2026-09-12",
  "updatedAt": "2026-09-13",
  "id": "zz-release-proof",
  "name": "Release path proof",
  "pitch": "A throwaway listing that proves the checks run on a pull request the release path opened.",
  "description": "Not an app. This listing exists only to show that the manifest checks run on a pull request opened by the release-to-listing path, using the archive and the numbers of Story Lantern 0.1.0. It is closed as soon as the checks report.",
  "version": "0.1.0",
  "license": "MIT",
  "homepage": "https://github.com/webdevtodayjason/story-lantern",
  "repo": "https://github.com/webdevtodayjason/story-lantern",
  "entry": {
    "command": "python3 lantern.py"
  },
  "requires": {
    "python": "3.9",
    "ports": [
      8420
    ],
    "device": {
      "models": [
        "chat",
        "image",
        "tts"
      ],
      "npuUnits": 89
    }
  },
  "permissions": [
    "files",
    "network",
    "device"
  ],
  "tags": [
    "stories",
    "family",
    "audio"
  ],
  "release": {
    "url": "https://github.com/webdevtodayjason/story-lantern/archive/refs/tags/v0.1.0.tar.gz",
    "sha256": "94be154239515236baf8bc8b3f0163ffd6c36cb8e68eae928eee85e1cd3a8541",
    "size": 3676365
  },
  "media": {
    "icon": "/assets/art/story-lantern-icon.png",
    "header": "/assets/art/story-lantern-header.webp"
  },
  "links": {
    "repo": "https://github.com/webdevtodayjason/story-lantern",
    "homepage": "https://github.com/webdevtodayjason/story-lantern"
  }
}
