{
  "author": {
    "name": "Titanium Computing",
    "url": "https://titanium.bot",
    "tiinyverse": "https://www.tiinyverse.com/users/39628b1e-e94e-4bd8-800e-5437d5336e1f"
  },
  "screenshots": [],
  "verified": false,
  "addedAt": "2026-09-12",
  "updatedAt": "2026-09-12",
  "id": "titanium-tiiny-bot",
  "name": "Titanium Tiiny Bot",
  "pitch": "A local assistant with chat, files, memories and voice.",
  "description": "Titanium Computing's assistant runs beside your Tiiny on Mac or Linux: chat, files, memories, skills, routines and voice, all on the device. Runs on the stdlib, no pip installs. Supports --selfcheck.",
  "version": "0.1.10",
  "license": "MIT",
  "homepage": "https://titanium.bot",
  "repo": "https://github.com/Titanium-Devops/titanium-bot-lite",
  "entry": {
    "python": "lite",
    "args": [
      "--port",
      "7788"
    ]
  },
  "requires": {
    "python": "3.11",
    "ports": [
      7788
    ],
    "device": {
      "models": [
        "chat",
        "tts"
      ],
      "npuUnits": 57
    }
  },
  "permissions": [
    "microphone",
    "files",
    "network",
    "device"
  ],
  "tags": [
    "assistant",
    "chat",
    "voice"
  ],
  "release": {
    "url": "https://github.com/Titanium-Devops/titanium-bot-lite/releases/download/v0.1.10/titanium-tiiny-bot-0.1.10.tar.gz",
    "sha256": "08160481931334c2422da7831fc41b8f4798e34ab1b8c933b79d6aeee995865d",
    "size": 433818
  },
  "health": "/api/health",
  "selfcheck": true,
  "media": {
    "icon": "https://tiinyapp.farm/assets/titanium-icon.png",
    "header": "https://tiinyapp.farm/assets/titanium-header.webp",
    "gallery": []
  },
  "links": {
    "repo": "https://github.com/Titanium-Devops/titanium-bot-lite",
    "homepage": "https://titanium.bot"
  }
}
