{
  "author": {
    "name": "Jason Brashear",
    "url": "https://github.com/webdevtodayjason"
  },
  "screenshots": [],
  "verified": false,
  "addedAt": "2026-09-12",
  "updatedAt": "2026-09-12",
  "id": "onelane",
  "name": "OneLane",
  "pitch": "Let cooperating apps take turns using one Tiiny.",
  "description": "A Python library providing shared file locks, busy retries and optional model-budget tracking. Copy onelane.py into your application; there is no app to start. Release pending: upstream declares no version and has no local release tags, so 0.1.0 is a proposed first farm release, not an observed upstream version. Live release lookup was blocked; size 0 means unknown. Farm uses Python 3.11; upstream does not state a minimum.",
  "version": "0.1.0",
  "license": "MIT",
  "homepage": "https://github.com/webdevtodayjason/onelane",
  "repo": "https://github.com/webdevtodayjason/onelane",
  "entry": null,
  "requires": {
    "ports": [],
    "device": {
      "models": [],
      "npuUnits": 0
    }
  },
  "permissions": [
    "files",
    "network",
    "device"
  ],
  "tags": [
    "library",
    "coordination",
    "developer-tools"
  ],
  "release": {
    "url": "https://github.com/webdevtodayjason/onelane/archive/refs/tags/v0.1.0.tar.gz",
    "sha256": "32d62db80bd789206753a418f341604304d69a0bfc8c1823f5f3e4ace9af2ab9",
    "size": 168709
  }
}
